{
    "catalog_schema_version": 4,
    "commit_id": "50f13f0c7c9f75e06e79f760e3b979363b777027",
    "configuration_schema_version": 2,
    "installation_time": "2015-06-05T21:12:54Z",
    "irods_version": "4.1.2",
    "previous_version": {
        "catalog_schema_version": 3,
        "commit_id": "77be27207aa3b191d2962d04f89e0d72b7253205",
        "configuration_schema_version": 1,
        "installation_time": "2014-08-20T17:36:40Z",
        "irods_version": "4.0.3"
    }
}
